H-ID,type_id,preferred_name,language_COLUMN,language_COLUMN TRM-ID,literary_form,literary_form TRM-ID,is_hypothetical,is_hypothetical TRM-ID,claim_freetext,alternative_names,is_expression_of H-ID,peripheral,peripheral TRM-ID,specific_genre H-ID,length,length_freetext,verse_type,verse_type TRM-ID,rhyme_type,rhyme_type TRM-ID,Stanza_type,Stanza_type TRM-ID,is_derived_from H-ID,nature_of_derivations,tradition_status,tradition_status TRM-ID,status_notes,in_stemma H-ID,has_lost_older_version,has_lost_older_version TRM-ID,ancient_translations_freetext,rewritings_freetext,note,regional_writing_style H-ID,scripta_freetext,date_of_creation,date_of_creation_certainty,date_of_creation_certainty TRM-ID,date_of_creation_source,date_freetext,is_written_by H-ID,is_adapted_by H-ID,author_freetext,place_of_creation H-ID,place_of_creation_source,described_by_source H-ID,described_at_URL,reference_notes,review_status,review_status TRM-ID,review_note
775,101,Antioche,fro (Old French),9470.0,verse,9549.0,No,9483,,[],[184],No,9498.0,44167.0,,,[alexandrine],[9555],[assonance],[9560],monorhyme 'laisse',9836.0,[754],,surviving,9480.0,,[],Yes,9482,[],[],Remaniement d'une chanson préexistante supposée du pélerin Richard.,47640.0,pic.,"{'comment': NULL, 'value': NULL, 'start': {'earliest': 1181-01-01 00:00:00, 'latest': NULL, 'estProfile': NULL, 'estDetermination': NULL}, 'end': {'earliest': NULL, 'latest': 1200-01-01 00:00:00, 'estProfile': NULL, 'estDetermination': NULL}, 'estDetermination': NULL, 'estProfile': NULL, 'timestamp': {'in': NULL, 'type': NULL, 'circa': false}, 'estMinDate': 1181-01-01 00:00:00, 'estMaxDate': 1200-12-31 00:00:00}",,,,"XIIfin, 1180-1200 (Arlima, Jonas)",[44964],[],Graindor de Douai,,,[47154],"[https://arlima.net/no/13734, http://jonas.irht.cnrs.fr/oeuvre/3194]","[ARLIMA: 255, https://arlima.net/no/255, MOISAN: CA1 (cycle: Croisade)]",Open,9698.0,
776,101,Aïmer le chétif,,,,,unknown,9770,,[],[98],,,,,,[],[],[],[],,,[],,lost,9478.0,,[],unknown,9770,[],[],"Conquérant de Venise. (Bossuat parle d'un fils d'Aimeri de Narbonne, et renvoie à R. Weeks, Aïmer le chétif, PMLA 17 (1902), 411-434 + R. Van Waard, Aïmer le chétif, Néophil. 25 (1940), 82-88. Voir aussi Moisan, sIII",,,"{'comment': NULL, 'value': NULL, 'start': {'earliest': 1101-01-01 00:00:00, 'latest': NULL, 'estProfile': NULL, 'estDetermination': NULL}, 'end': {'earliest': NULL, 'latest': 1220-01-01 00:00:00, 'estProfile': NULL, 'estDetermination': NULL}, 'estDetermination': NULL, 'estProfile': NULL, 'timestamp': {'in': NULL, 'type': NULL, 'circa': false}, 'estMinDate': 1101-01-01 00:00:00, 'estMaxDate': 1220-12-31 00:00:00}",,,,XII-XIIIdeb,[],[],,,,[],[https://arlima.net/no/3469],"[ARLIMA: 3469, https://arlima.net/no/3469, BOSSUAT: I p. 21]",,,
777,101,Aimeri de Narbonne perdu,,,,,unknown,9770,,[],[97],,,,,,[],[],[],[],,,[],,lost,9478.0,,[],unknown,9770,[],[],"Modèle perdu de Bertrand de Bar-sur-Aube, hypothèse soutenue par mention chez Guilhem de Berguedan, cf. M. de Riquer, les chansons de geste françaises, 2e ed, 1968, p. 165.",,,"{'comment': NULL, 'value': NULL, 'start': {'earliest': 1100-01-01 00:00:00, 'latest': NULL, 'estProfile': NULL, 'estDetermination': NULL}, 'end': {'earliest': NULL, 'latest': 1187-01-01 00:00:00, 'estProfile': NULL, 'estDetermination': NULL}, 'estDetermination': NULL, 'estProfile': NULL, 'timestamp': {'in': NULL, 'type': NULL, 'circa': false}, 'estMinDate': 1100-01-01 00:00:00, 'estMaxDate': 1187-12-31 00:00:00}",,,,"XII?, av. 1187",[],[],,,,[],[],[],,,
778,101,Ami et Amile perdu,fro (Old French),9470.0,unknown,9726.0,Yes,9482,"Source possible de l'épître latine de Raoul le Tourtier, mort en 1114, et de la version conservée (cf DLF, 1964, p. 53), ainsi que d'autres dérivés (cf. Moisan sIII).",[],[62],No,9498.0,,,,[],[],[],[],,,[],,lost,9478.0,,[],unknown,9770,[],[],,,,"{'comment': NULL, 'value': NULL, 'start': {'earliest': 1001-01-01 00:00:00, 'latest': NULL, 'estProfile': NULL, 'estDetermination': NULL}, 'end': {'earliest': NULL, 'latest': 1114-01-01 00:00:00, 'estProfile': NULL, 'estDetermination': NULL}, 'estDetermination': NULL, 'estProfile': NULL, 'timestamp': {'in': NULL, 'type': NULL, 'circa': false}, 'estMinDate': 1001-01-01 00:00:00, 'estMaxDate': 1114-12-31 00:00:00}",,,,"XI-XIIdeb, av. 1114",[],[],,,,[],[],[],Open,9698.0,
779,101,Tersin,pro (Occitan),9471.0,,,unknown,9770,,[],[230],,,,,,[],[],[],[],,,[],,lost,9478.0,,[],unknown,9770,[],[],"Chanson perdue mais supposée, à paritr de deux mises en prose provençales tardives, de la Kaiserkronik et d'autres sources par P. Meyer, Tersin, tradition arlésienne, R, 1-1, 1872. p. 51-68, https://doi.org/10.3406/roma.1872.6562",,,"{'comment': NULL, 'value': NULL, 'start': {'earliest': 1200-01-01 00:00:00, 'latest': NULL, 'estProfile': NULL, 'estDetermination': NULL}, 'end': {'earliest': NULL, 'latest': 1300-01-01 00:00:00, 'estProfile': NULL, 'estDetermination': NULL}, 'estDetermination': NULL, 'estProfile': NULL, 'timestamp': {'in': NULL, 'type': NULL, 'circa': false}, 'estMinDate': 1200-01-01 00:00:00, 'estMaxDate': 1300-12-31 00:00:00}",,,,XIII?,[],[],,,,[],[],[],,,
780,101,"Arnaïs d'Orléans, roi de Hongrie",,,,,unknown,9770,,[],[192],,,,,,[],[],[],[],,,[],,lost,9478.0,,[],unknown,9770,[],[],"Louis Gemenne, « Sansonnet : avis de recherche d'un orphelin épique », L'épopée romane 1, t.~2, p.~665-676. Résumé de cette chanson subsiste dans la Chronique Française (Moisan, ChF textes annexes), transcrit par Gaston Paris, Hist poet 403. Utilisée par les auteurs du Couronnement Louis, de la Chronique Saintongeaise, par Aubri de Trois Fontaines, et parmi les sources du Loher und Maller allemand. Cf. Moisan sIII. Existait encore fin XVe, car, dans un Inventaire des bijoux, vêtements, manuscrits et objets précieux appartenant à la comtesse de Montpensier (1443-1474) éd. M. de Boislile, un ""Le libre Arnaïs d'Orléans"" cf. R 10 447, Bull. Soc. Hist. fr. 17 1880 269-309. (rapporté aussi dans M. J. Devaux, Essai sur les premiers seigneurs de Pithiviers (suite et fin), , Annales Soc. hist. et archéol. du Gâtinais, 4, 1886).",,,"{'comment': NULL, 'value': NULL, 'start': {'earliest': 1100-01-01 00:00:00, 'latest': NULL, 'estProfile': NULL, 'estDetermination': NULL}, 'end': {'earliest': NULL, 'latest': 1130-01-01 00:00:00, 'estProfile': NULL, 'estDetermination': NULL}, 'estDetermination': NULL, 'estProfile': NULL, 'timestamp': {'in': NULL, 'type': NULL, 'circa': false}, 'estMinDate': 1100-01-01 00:00:00, 'estMaxDate': 1130-12-31 00:00:00}",,,,"XII?, av. 1130",[],[],,,,[],[https://arlima.net/no/6489],"[ARLIMA: 6489, https://arlima.net/no/6489]",,,
781,101,Audigier perdu,,,,,unknown,9770,,[],[231],,,,,,[],[],[],[],,,[],,lost,9478.0,,[],unknown,9770,[],[],"Témoignages d'une version antérieure à celle conservée, cf. P. Meyer, R 7 1878 450; O. Jodogne, Le Moyen Âge 66 1960 502 506 (témoignage d'Aiol). Cf. Moisan sIII.",,,"{'comment': NULL, 'value': NULL, 'start': {'earliest': 1101-01-01 00:00:00, 'latest': NULL, 'estProfile': NULL, 'estDetermination': NULL}, 'end': {'earliest': NULL, 'latest': 1200-01-01 00:00:00, 'estProfile': NULL, 'estDetermination': NULL}, 'estDetermination': NULL, 'estProfile': NULL, 'timestamp': {'in': NULL, 'type': NULL, 'circa': false}, 'estMinDate': 1101-01-01 00:00:00, 'estMaxDate': 1200-12-31 00:00:00}",,,,XII,[],[],,,,[],[],[],,,
782,101,Balan,,,,,unknown,9770,,[],[156],,,,,,[],[],[],[],,,[],,lost,9478.0,,[],unknown,9770,[],[],"modèle de Fierabras, ou texte dont Fierabras est la continuation. Attesté par le résumé de Philippe Mouskés, chron. rimée (c. 1260), la longue préf. de Fierabras et la Destr. de Rome. Cf. Moisan sIII.",,,"{'comment': NULL, 'value': NULL, 'start': {'earliest': 1100-01-01 00:00:00, 'latest': NULL, 'estProfile': NULL, 'estDetermination': NULL}, 'end': {'earliest': NULL, 'latest': 1170-01-01 00:00:00, 'estProfile': NULL, 'estDetermination': NULL}, 'estDetermination': NULL, 'estProfile': NULL, 'timestamp': {'in': NULL, 'type': NULL, 'circa': false}, 'estMinDate': 1100-01-01 00:00:00, 'estMaxDate': 1170-12-31 00:00:00}",,,,"XII?, avant 1170",[],[],,,,[],[],[],,,
783,101,Basin,fro (Old French),9470.0,unknown,9726.0,Yes,9482,,[],[225],No,9498.0,44167.0,,,[],[],[],[],,,[],,lost,9478.0,,[],unknown,9770,"[Karel ende Elegast néerlandais, Karlamagnus saga]",[],"Correspond-elle au « Unus liber romanizatus de Duce de Basyns. [chanson de Basin ?] » de l'inventaire des livres d'Isabelle de France, reine d'Angleterre ? Sur cette chanson, voir Bédier, Joseph, « La légende des ""enfances"" de Charlemagne et l'histoire de Charles Martel », Studies in Honor of A. Marshall Elliott, in Two Volumes, Baltimore, Johns Hopkins Press; Paris, Champion; Leipzig, Harrassowitz, 1911, t. 1, p. 81-107. [IA: t. 1, t. 2] Bonnier, Charles, « Un nouveau témoignage sur la chanson de Basin », Romania, 29, 1900, p. 425-426. [GB: ex. 1, ex. 2] [Gall] [IA] Rombauts, E., « Le Karel ende Elegast néerlandais et la Chanson de Basin », Études germaniques, 31, 1976, p. 369-491. Ainsi que Romania 21, p. 296. Cf. aussi Moisan sIII, avec d'autres réfs. La version néerlandaise pourrait être l'original ! (https://en.wikipedia.org/wiki/Elegast )",,,"{'comment': NULL, 'value': NULL, 'start': {'earliest': 1100-01-01 00:00:00, 'latest': NULL, 'estProfile': NULL, 'estDetermination': NULL}, 'end': {'earliest': NULL, 'latest': 1230-01-01 00:00:00, 'estProfile': NULL, 'estDetermination': NULL}, 'estDetermination': NULL, 'estProfile': NULL, 'timestamp': {'in': NULL, 'type': NULL, 'circa': false}, 'estMinDate': 1100-01-01 00:00:00, 'estMaxDate': 1230-12-31 00:00:00}",,,,XII? avant 1230,[],[],,,,"[47163, 47164, 47165, 47166]",[https://arlima.net/no/4931],"[ARLIMA: 4931, https://arlima.net/no/4931, MOISAN: r CE étr., BOSSUAT: sIII p. 102]",Open,9698.0,
784,101,Berte,fro (Old French),9470.0,unknown,9726.0,Yes,9482,"modèle d'Adenet, connu par l'auteur de la Chronique saintongeaise et Philippe Mouskés; utilisé par l'auteur de la Gran Conquista de Ultramar et le rédacteur franco-italien. Voir E. Faral, R, 40 1911 93-96. Le contenu des textes allemands, de l'Aquilon de Bavière, etc., laissent supposer plusieurs versions intermédiaires perdues. Moisan sIII",[],[174],No,9498.0,44167.0,,,[],[],[],[],,,[],,lost,9478.0,,[],unknown,9770,[],[],,,,"{'comment': NULL, 'value': NULL, 'start': {'earliest': 1101-01-01 00:00:00, 'latest': NULL, 'estProfile': NULL, 'estDetermination': NULL}, 'end': {'earliest': NULL, 'latest': 1225-01-01 00:00:00, 'estProfile': NULL, 'estDetermination': NULL}, 'estDetermination': NULL, 'estProfile': NULL, 'timestamp': {'in': NULL, 'type': NULL, 'circa': false}, 'estMinDate': 1101-01-01 00:00:00, 'estMaxDate': 1225-12-31 00:00:00}",,,,XII? avant 1225,[],[],,,,[],[],[],Open,9698.0,
785,101,Bueve de Hanstonne perdu,,,,,unknown,9770,,[],[148],,,,,,[],[],[],[],,,[],,lost,9478.0,,[],unknown,9770,[],[],"Perdue, mais allusions des troubadours catalans Guilhem de Berguedan et Guirant del Luc. Moisan sIII.",,,"{'comment': NULL, 'value': NULL, 'start': {'earliest': 1100-01-01 00:00:00, 'latest': NULL, 'estProfile': NULL, 'estDetermination': NULL}, 'end': {'earliest': NULL, 'latest': 1187-01-01 00:00:00, 'estProfile': NULL, 'estDetermination': NULL}, 'estDetermination': NULL, 'estProfile': NULL, 'timestamp': {'in': NULL, 'type': NULL, 'circa': false}, 'estMinDate': 1100-01-01 00:00:00, 'estMaxDate': 1187-12-31 00:00:00}",,,,XII? avant 1187,[],[],,,,[],[],[],,,
911,101,Florent et Octavien,fro (Old French),9470.0,verse,9549.0,Yes,9482,"Hypothetical source text of all versions of Florent and Octavien, that would be a chanson of the 12th century, according to Krappe Alexander Haggerty. Florent et Octavian. In: Romania, tome 65 n°259, 1939. pp. 359-373. DOI : https://doi.org/10.3406/roma.1939.3945
But the existence of this original version is contested by Bossuat, with good arguments, in 
 Bossuat Robert. Florent et Octavien, chanson de geste du XIVe siècle. In: Romania, tome 73 n°291, 1952. pp. 289-331.DOI : https://doi.org/10.3406/roma.1952.3326",[],[209],No,9498.0,44167.0,,,[],[],[],[],,,[],,lost,9478.0,"chanson hypothéthique, source des versions des 13e et 14e",[],unknown,9770,"[English (1/2), German (1/1), Italian (1/2), possibly a castillan version, English (2/2), Italien (2/2)]","[prose, French version in octosyllabic verses of the 13th c., French version in alexandrines of the 14th c.]",Stemma in: Krappe_1939_FlorentOctavien,,,"{'comment': NULL, 'value': NULL, 'start': {'earliest': 1101-01-01 00:00:00, 'latest': NULL, 'estProfile': NULL, 'estDetermination': NULL}, 'end': {'earliest': NULL, 'latest': 1200-01-01 00:00:00, 'estProfile': NULL, 'estDetermination': NULL}, 'estDetermination': NULL, 'estProfile': NULL, 'timestamp': {'in': NULL, 'type': NULL, 'circa': false}, 'estMinDate': 1101-01-01 00:00:00, 'estMaxDate': 1200-12-31 00:00:00}",,,,,[],[],,,,[],[],[],Open,9698.0,
913,101,Florent et Octavien,frm (Middle French),9557.0,prose,9550.0,No,9483,,[],[209],No,9498.0,44128.0,,,[],[],[],[],,,[],,surviving,9480.0,,[],Yes,9482,[],[],"Mise en prose of Florent et Octavien, also followed by "" a series of imprints running from 1500 into the early seventeenth century"". Florent et Octavien: The Fourteenth-Century Poem
Charity Cannon Willard
Olifant, Vol. 14, No. 3/4 (Fall & Winter 1989), pp. 179-189 
https://www.jstor.org/stable/45298813",,,"{'comment': NULL, 'value': NULL, 'start': {'earliest': 1301-01-01 00:00:00, 'latest': NULL, 'estProfile': NULL, 'estDetermination': NULL}, 'end': {'earliest': NULL, 'latest': 1400-01-01 00:00:00, 'estProfile': NULL, 'estDetermination': NULL}, 'estDetermination': NULL, 'estProfile': NULL, 'timestamp': {'in': NULL, 'type': NULL, 'circa': false}, 'estMinDate': 1301-01-01 00:00:00, 'estMaxDate': 1400-12-31 00:00:00}",,,,14e s. (Jonas),[],[],,,,[],[http://jonas.irht.cnrs.fr/oeuvre/9042],"[ARLIMA: 12072, https://arlima.net/no/12072]",Action required,9697.0,scrape
914,101,Florent et Octavien,frm (Middle French),9557.0,verse,9549.0,No,9483,,[],[209],No,9498.0,44167.0,18500.0,,[alexandrine],[9555],[full rhyme],[9779],monorhyme 'laisse',9836.0,[648],,surviving,9480.0,,[],unknown,9770,[],[],stemma in Laborderie 1991,,,"{'comment': NULL, 'value': NULL, 'start': {'earliest': 1352-01-01 00:00:00, 'latest': NULL, 'estProfile': NULL, 'estDetermination': NULL}, 'end': {'earliest': NULL, 'latest': 1361-01-01 00:00:00, 'estProfile': NULL, 'estDetermination': NULL}, 'estDetermination': NULL, 'estProfile': NULL, 'timestamp': {'in': NULL, 'type': NULL, 'circa': false}, 'estMinDate': 1352-01-01 00:00:00, 'estMaxDate': 1361-12-31 00:00:00}",,,,"Vers 1356; v. 1-11989, parties I et II, seraient datables de ca. 1356, v. 11990-18509, III, de ca. 1400, according to Laborderie",[],[],,,,[],[https://arlima.net/no/12071],"[ARLIMA: 12071, https://arlima.net/no/12071]",Open,9698.0,
46225,101,Moniage Guillaume perdu,fro (Old French),9470.0,verse,9549.0,Yes,9482,,[],[91],,,44167.0,,,[],[],[],[],,,[],,lost,9478.0,,[],unknown,9770,[],[],,,,"{'comment': NULL, 'value': NULL, 'start': {'earliest': 1101-01-01 00:00:00, 'latest': NULL, 'estProfile': NULL, 'estDetermination': NULL}, 'end': {'earliest': NULL, 'latest': 1133-01-01 00:00:00, 'estProfile': NULL, 'estDetermination': NULL}, 'estDetermination': NULL, 'estProfile': NULL, 'timestamp': {'in': NULL, 'type': NULL, 'circa': false}, 'estMinDate': 1101-01-01 00:00:00, 'estMaxDate': 1133-12-31 00:00:00}",3. Very likely (66%-99%),9762.0,"Anterior to both kept redactions of the Moniage Guillaume, of which the earliest is supposed to be 12e 2/3",Before the 12e 2/3,[],[],,,,[],[],[],Open,9698.0,
46303,101,Floovent,dum (Middle Dutch),9728.0,verse,9549.0,No,9483,,[],[74],No,9498.0,46304.0,8000.0,,[],[],[],[],,,[647],,fragmentary,9477.0,,[],unknown,9770,[],[],,46305.0,,"{'comment': NULL, 'value': NULL, 'start': {'earliest': 1191-01-01 00:00:00, 'latest': NULL, 'estProfile': slowStart, 'estDetermination': NULL}, 'end': {'earliest': NULL, 'latest': 1240-01-01 00:00:00, 'estProfile': slowFinish, 'estDetermination': NULL}, 'estDetermination': conjecture, 'estProfile': central, 'timestamp': {'in': NULL, 'type': NULL, 'circa': false}, 'estMinDate': 1191-01-01 00:00:00, 'estMaxDate': 1240-12-31 00:00:00}",2. Probable (33%-66%),9763.0,"Caers & Kestemont (2011), p. 16.",'ca. 1200 – ca. 1230',[],[],,,,[],[],[Refer to article Caers & Kestemont],Action required,9697.0,"Add reference, add location."
46316,101,Loyhier en Malaert,dum (Middle Dutch),9728.0,verse,9549.0,No,9483,,[Lohier ende Malaert],[72],No,9498.0,46304.0,30000.0,,[],[],[full rhyme],[9779],,,[766],,fragmentary,9477.0,,[],unknown,9770,[],[],,,"""misschien Vlaanderen"" (Kienhorst 1988, 123 met verwijzing naar Van den Berg 1985, 22)","{'comment': NULL, 'value': NULL, 'start': {'earliest': 1301-01-01 00:00:00, 'latest': NULL, 'estProfile': NULL, 'estDetermination': NULL}, 'end': {'earliest': NULL, 'latest': 1350-01-01 00:00:00, 'estProfile': NULL, 'estDetermination': NULL}, 'estDetermination': conjecture, 'estProfile': central, 'timestamp': {'in': NULL, 'type': NULL, 'circa': false}, 'estMinDate': 1301-01-01 00:00:00, 'estMaxDate': 1350-12-31 00:00:00}",2. Probable (33%-66%),9763.0,"Caers & Kestemont 2011, 36-37","""eerste helft veertiende eeuw""",[],[],,,,[],[],[],Open,9698.0,Link met Franse versie opnieuw te bekijken...
46322,101,Roelantslied,dum (Middle Dutch),9728.0,verse,9549.0,No,9483,,[],[941],No,9498.0,46304.0,5250.0,,[],[],[full rhyme],[9779],,,[690],,fragmentary,9477.0,,[],No,9483,[],[],,46305.0,,"{'comment': NULL, 'value': NULL, 'start': {'earliest': 1191-01-01 00:00:00, 'latest': NULL, 'estProfile': NULL, 'estDetermination': NULL}, 'end': {'earliest': NULL, 'latest': 1240-01-01 00:00:00, 'estProfile': NULL, 'estDetermination': NULL}, 'estDetermination': conjecture, 'estProfile': central, 'timestamp': {'in': NULL, 'type': NULL, 'circa': false}, 'estMinDate': 1191-01-01 00:00:00, 'estMaxDate': 1240-12-31 00:00:00}",2. Probable (33%-66%),9763.0,"Caers & Kestemont (2011), p. 17.",'ca. 1200 – ca. 1230',[],[],,,,[],[],[Add Caers & Kestemont (2011) and Verbraeken (2023)],Action required,9697.0,Add references.
46323,101,Karel ende Elegast,dum (Middle Dutch),9728.0,verse,9549.0,No,9483,,[],[225],No,9498.0,46304.0,1472.0,,[],[],[full rhyme],[9779],couplets,9837.0,[783],The dependence on Basin is contested,fragmentary,9477.0,only manuscript fragments exist; the complete text was printed,[],No,9483,[],[],,46305.0,,"{'comment': NULL, 'value': NULL, 'start': {'earliest': 1216-01-01 00:00:00, 'latest': NULL, 'estProfile': NULL, 'estDetermination': NULL}, 'end': {'earliest': NULL, 'latest': 1260-01-01 00:00:00, 'estProfile': NULL, 'estDetermination': NULL}, 'estDetermination': conjecture, 'estProfile': central, 'timestamp': {'in': NULL, 'type': NULL, 'circa': false}, 'estMinDate': 1216-01-01 00:00:00, 'estMaxDate': 1260-12-31 00:00:00}",2. Probable (33%-66%),9763.0,"Caers & Kestemont 2011, p. 19","""Ca. 1225 - ca. 1250""",[],[],,,,"[47485, 47482, 47484, 47483]",[https://www.handschriftencensus.de/werke/2101],[],Action required,9697.0,"Now added Basin as text source, or leave open?"
46333,101,Limburgse Aiol,dum (Middle Dutch),9728.0,verse,9549.0,No,9483,,[Aiol (1)],[138],No,9498.0,46304.0,10000.0,,[iambic],[9780],[full rhyme],[9779],,,[46352],,fragmentary,9477.0,,[],No,9483,[],[],,46335.0,,"{'comment': NULL, 'value': NULL, 'start': {'earliest': 1171-01-01 00:00:00, 'latest': NULL, 'estProfile': NULL, 'estDetermination': NULL}, 'end': {'earliest': NULL, 'latest': 1220-01-01 00:00:00, 'estProfile': NULL, 'estDetermination': NULL}, 'estDetermination': conjecture, 'estProfile': central, 'timestamp': {'in': NULL, 'type': NULL, 'circa': false}, 'estMinDate': 1171-01-01 00:00:00, 'estMaxDate': 1220-12-31 00:00:00}",2. Probable (33%-66%),9763.0,"Caers & Kestemont 2011, p. 13-14","""omstreeks de eeuwwisseling, enkele decennia na het ontstaan van de Oudfranse bron rond 1160""",[],[],,,,[],[],[],Open,9698.0,
46337,101,Þjalar-Jóns saga,non (Old Norse),9740.0,prose,9550.0,No,9483,,[],[46382],No,9498.0,46367.0,,,[],[],[],[],,,[],,surviving,9480.0,,[],unknown,9770,[],[],,,,"{'comment': NULL, 'value': NULL, 'start': {'earliest': 1301-01-01 00:00:00, 'latest': NULL, 'estProfile': NULL, 'estDetermination': NULL}, 'end': {'earliest': NULL, 'latest': 1400-01-01 00:00:00, 'estProfile': NULL, 'estDetermination': NULL}, 'estDetermination': conjecture, 'estProfile': NULL, 'timestamp': {'in': NULL, 'type': NULL, 'circa': false}, 'estMinDate': 1301-01-01 00:00:00, 'estMaxDate': 1400-12-31 00:00:00}",3. Very likely (66%-99%),9762.0,Kalinke & Mitchell (1985),,[],[],,,,[],[],[],Open,9698.0,
46352,101,Aiol primitif,fro (Old French),9470.0,verse,9549.0,Yes,9482,"Hypothetical primitive redaction of the Chanson d'Aiol, that would have been the source of the Limbourgeoise Middle Dutch translation (Baukje Finet, 2006, Romania, https://doi.org/10.3406/roma.2006.6868)",[],[138],No,9498.0,44167.0,,,[decasyllabe],[9554],[assonance],[9560],,,[],,lost,9478.0,,[],No,9483,[],[],,,,"{'comment': NULL, 'value': NULL, 'start': {'earliest': 1151-01-01 00:00:00, 'latest': NULL, 'estProfile': NULL, 'estDetermination': NULL}, 'end': {'earliest': NULL, 'latest': 1173-01-01 00:00:00, 'estProfile': NULL, 'estDetermination': NULL}, 'estDetermination': conjecture, 'estProfile': slowStart, 'timestamp': {'in': NULL, 'type': NULL, 'circa': false}, 'estMinDate': 1151-01-01 00:00:00, 'estMaxDate': 1173-12-31 00:00:00}",2. Probable (33%-66%),9763.0,"Finet Baukje. La Tradition écrite de la chanson d'Aiol. Une mise au point. Romania, tome 124 n°495-496, 2006. pp. 503-508.
DOI : https://doi.org/10.3406/roma.2006.6868",Before 1173 (Finet); seconde moitié du XIIe siècle (Arlima),[],[],,,,[],[],[],Open,9698.0,
46392,101,Vlaamse Aiol,dum (Middle Dutch),9728.0,verse,9549.0,No,9483,,[Aiol (2)],[138],No,9498.0,46304.0,5000.0,"Estimate bij Van der Have (2005), p. 80: '""ruim 5000 verzen'",[],[],[full rhyme],[9779],,,[46352],,fragmentary,9477.0,,[],No,9483,[],[],,46305.0,"Localisation by Caers (2011), p. 225","{'comment': NULL, 'value': NULL, 'start': {'earliest': 1201-01-01 00:00:00, 'latest': NULL, 'estProfile': NULL, 'estDetermination': NULL}, 'end': {'earliest': NULL, 'latest': 1275-01-01 00:00:00, 'estProfile': NULL, 'estDetermination': NULL}, 'estDetermination': conjecture, 'estProfile': central, 'timestamp': {'in': NULL, 'type': NULL, 'circa': false}, 'estMinDate': 1201-01-01 00:00:00, 'estMaxDate': 1275-12-31 00:00:00}",2. Probable (33%-66%),9763.0,"Caers & Kestemont (2011), p. 19","""ca. 1225 - ca. 1250""",[],[],,,,[],[],[],Action required,9697.0,Add reference
46394,101,Vilmundar saga viðutan,non (Old Norse),9740.0,prose,9550.0,No,9483,,[],[46393],No,9498.0,46367.0,,,[],[],[],[],,,[],,surviving,9480.0,,[],unknown,9770,[],[],,,,"{'comment': NULL, 'value': NULL, 'start': {'earliest': 1301-01-01 00:00:00, 'latest': NULL, 'estProfile': NULL, 'estDetermination': NULL}, 'end': {'earliest': NULL, 'latest': 1400-01-01 00:00:00, 'estProfile': NULL, 'estDetermination': NULL}, 'estDetermination': conjecture, 'estProfile': NULL, 'timestamp': {'in': NULL, 'type': NULL, 'circa': false}, 'estMinDate': 1301-01-01 00:00:00, 'estMaxDate': 1400-12-31 00:00:00}",3. Very likely (66%-99%),9762.0,,,[],[],,,,[],[],[Kalinke & Mitchell],Open,9698.0,
46893,101,Iwein,gmh (Middle High German),9735.0,verse,9549.0,No,9483,,[],[],No,9498.0,46894.0,,,[],[],[],[],,,[],,surviving,9480.0,,[],No,9483,[],[],Stemma in: Paul_1874_Iwein,,,"{'comment': NULL, 'value': NULL, 'start': {'earliest': 1191-01-01 00:00:00, 'latest': NULL, 'estProfile': NULL, 'estDetermination': NULL}, 'end': {'earliest': NULL, 'latest': 1210-01-01 00:00:00, 'estProfile': NULL, 'estDetermination': NULL}, 'estDetermination': NULL, 'estProfile': central, 'timestamp': {'in': NULL, 'type': NULL, 'circa': false}, 'estMinDate': 1191-01-01 00:00:00, 'estMaxDate': 1210-12-31 00:00:00}",2. Probable (33%-66%),9763.0,Gustavo (to check),,[46895],[],,,,[],[https://www.handschriftencensus.de/werke/150],[],Action required,9697.0,Example entry made for a Middle High German text
47283,101,Ogier van Denemarken,dum (Middle Dutch),9728.0,verse,9549.0,No,9483,,[],[126],No,9498.0,46304.0,23700.0,"'Ik heb lang getwijfeld om in mijn berekening de opsplitsing tussen Ogier I en Ogier II ook te maken
maar ik heb uiteindelijk, net als Van der Have, beslist om dit niet te doen. In mijn berekening schat ik
Ogier van Denemarken op ten minste 23.700 verzen.' Verbraeken 2023, p. 44.",[],[],[full rhyme],[9779],couplets,9837.0,[721],,fragmentary,9477.0,,[],No,9483,[],[],,46305.0,,"{'comment': NULL, 'value': NULL, 'start': {'earliest': 1235-01-01 00:00:00, 'latest': NULL, 'estProfile': NULL, 'estDetermination': NULL}, 'end': {'earliest': NULL, 'latest': 1375-01-01 00:00:00, 'estProfile': NULL, 'estDetermination': NULL}, 'estDetermination': conjecture, 'estProfile': central, 'timestamp': {'in': NULL, 'type': NULL, 'circa': false}, 'estMinDate': 1235-01-01 00:00:00, 'estMaxDate': 1375-12-31 00:00:00}",2. Probable (33%-66%),9763.0,"Caers & Kestemont (2011), p. 40.",'Op deze manier zou Ogiers kintshede omstreeks 1260-1270 geschreven kunnen zijn en de olthede rond de eeuwwisseling (of nog later).',[],[],,,,"[47485, 47482, 47484, 47483]",[https://www.handschriftencensus.de/werke/2143],[],Open,9698.0,
